id,tweetContent,tweetContentProcessed
tweetImg0,"A giant 150-year-old banyan tree in Lahaina, Hawaii, was badly burned in the fires that ravaged Maui last month.

Then, green shoots began to unfurl around its trunk, hinting at the possibility of recovery for the tree and the community.
https://t.co/0bAuTvYIzL https://t.co/kwNQlybY3h",A giant 150yearold banyan tree in Lahaina Hawaii was badly burned in the fires that ravaged Maui last month Then green shoots began to unfurl around its trunk hinting at the possibility of recovery for the tree and the community
tweetImg1,How did you do in Connections today? You’re given 16 words. Your mission: Identify the hidden relationships and organize them into four distinct groups of four. https://t.co/7SLFBTdHQE https://t.co/VkP3UINerV,How did you do in Connections today Youre given 16 words Your mission Identify the hidden relationships and organize them into four distinct groups of four
tweetImg2,Have you ever wondered why we name hurricanes? The New York Times meteorologist Judson Jones explains. https://t.co/qPZpHV3SG8 https://t.co/CRiNSx8J4I,Have you ever wondered why we name hurricanes The New York Times meteorologist Judson Jones explains
tweetImg3,"The third annual New York Times Restaurant List is here. It wasn’t easy to narrow it down, but here are the 50 best restaurants in the U.S. https://t.co/ysVBoAyJ2W https://t.co/aFmGQWJvpc",The third annual New York Times Restaurant List is here It wasnt easy to narrow it down but here are the 50 best restaurants in the US
tweetImg4,"""It is the best chili I ever made or ate. So much flavor, so good."" 

This recipe makes a thick, comforting chili that can be prepared in a slow cooker or in a Dutch oven on the stovetop. https://t.co/STInvIC2dY https://t.co/NWw13e3W6l",It is the best chili I ever made or ate So much flavor so good This recipe makes a thick comforting chili that can be prepared in a slow cooker or in a Dutch oven on the stovetop
tweetImg5,"After experiencing an unsolicited wave of viral fame, the owners of the wine and ice cream bar Folderol in Paris took a number of measures to manage crowds, including hiring a bouncer and putting up a “No TikTok” sign. https://t.co/4YYYu8DGxe https://t.co/uTA5aFYiIk",After experiencing an unsolicited wave of viral fame the owners of the wine and ice cream bar Folderol in Paris took a number of measures to manage crowds including hiring a bouncer and putting up a No TikTok sign
tweetImg6,"""Deported people must come back home, and the occupier must return to their own land.""

President Zelensky of Ukraine presented Russia’s aggression as a worldwide unrelenting threat that would not stop at the borders of Ukraine at the UN General Assembly. https://t.co/gEJ30wKaM9 https://t.co/i2ixVZ7PQW",Deported people must come back home and the occupier must return to their own land President Zelensky of Ukraine presented Russias aggression as a worldwide unrelenting threat that would not stop at the borders of Ukraine at the UN General Assembly
tweetImg7,"Dear tomato season,

It's not goodbye, it's until we meet again. https://t.co/kFzBfptT6d https://t.co/Yq7sdLW9pW",Dear tomato season Its not goodbye its until we meet again
tweetImg8,"At 14, Marcos Cux was maimed while working the overnight cleaning shift at a Perdue slaughterhouse in rural Virginia. He’s just one of the thousands of migrant children trapped in dangerous jobs across the U.S. https://t.co/aOmmJjGqLC https://t.co/n840vHrBw4",At 14 Marcos Cux was maimed while working the overnight cleaning shift at a Perdue slaughterhouse in rural Virginia Hes just one of the thousands of migrant children trapped in dangerous jobs across the US
tweetImg9,From @TheAthletic: Order was restored during Week 2 of the NFL season. We ranked every team from the No. 1 Cowboys to the No. 32 Cardinals. https://t.co/odzr1mGE8d https://t.co/KGvA8sTcr9,From TheAthletic Order was restored during Week 2 of the NFL season We ranked every team from the No 1 Cowboys to the No 32 Cardinals
tweetImg10,"""If we allow Ukraine to be carved up, is the independence of any nation secure?"" President Biden asked world leaders at the UN General Assembly on Tuesday, where he condemned Russia’s ""naked aggression."" https://t.co/zNimymqyWw https://t.co/DUSj5KF4ra",If we allow Ukraine to be carved up is the independence of any nation secure President Biden asked world leaders at the UN General Assembly on Tuesday where he condemned Russias naked aggression
tweetImg11,"From @TheAthletic: The Padres' 2023 season unfolded like a nightmare. One player called it an “institutional failure.” San Diego has questions to answer, including how long they can stick with A.J. Preller. https://t.co/0Qae1YNnh7 https://t.co/1n3JWiI3cT",From TheAthletic The Padres 2023 season unfolded like a nightmare One player called it an institutional failure San Diego has questions to answer including how long they can stick with AJ Preller
tweetImg12,Eric Kim’s mother tasted his innovative version of bibimbap and told him she’d never make it the traditional way again. https://t.co/mp1EWI0AxQ https://t.co/zy4Wv0YigK,Eric Kims mother tasted his innovative version of bibimbap and told him shed never make it the traditional way again
tweetImg13,Companies like the celebrity-endorsed Prenuvo claim they can revolutionize preventive health care with fully body MRIs. Experts warn this might not be the right approach. https://t.co/ndqmkt2pCj https://t.co/iJ7gbKVBfv,Companies like the celebrityendorsed Prenuvo claim they can revolutionize preventive health care with fully body MRIs Experts warn this might not be the right approach
tweetImg14,"Shakira, Karol G, Camilo and Bad Bunny are among the most nominated acts for the 24th annual Latin Grammy Awards. But leading all of the headliners is the Mexican American hitmaker Edgar Barrera — also known as Edge — who earned 13 total nominations. https://t.co/PBiKEfxd5W https://t.co/xUfRjWOOdd",Shakira Karol G Camilo and Bad Bunny are among the most nominated acts for the 24th annual Latin Grammy Awards But leading all of the headliners is the Mexican American hitmaker Edgar Barrera also known as Edge who earned 13 total nominations
tweetImg15,How did you do in Connections today? You’re given 16 words. Your mission: Identify the hidden relationships and organize them into four distinct groups of four. https://t.co/UwDr6EZ8Qs https://t.co/NFStukGX3h,How did you do in Connections today Youre given 16 words Your mission Identify the hidden relationships and organize them into four distinct groups of four
tweetImg16,"People from Montana to Missouri reported sightings of the aurora borealis on Monday night, as the phenomenon stained the night sky with green and purple blotches.
https://t.co/SLP8e1kzMD https://t.co/l9DiRZepam",People from Montana to Missouri reported sightings of the aurora borealis on Monday night as the phenomenon stained the night sky with green and purple blotches
tweetImg17,"From @TheAthletic: On the ice, his body takes thunderous hits. Off the ice, it makes art. https://t.co/HkO6Yl1B0E https://t.co/m50eayJcsQ",From TheAthletic On the ice his body takes thunderous hits Off the ice it makes art
tweetImg18,How quickly can you solve today's Mini crossword? https://t.co/9sF4jmawrv https://t.co/KncnMl36qM,How quickly can you solve todays Mini crossword
tweetImg19,How did you do in Connections today? You’re given 16 words. Your mission: Identify the hidden relationships and organize them into four distinct groups of four. https://t.co/A3AS3Aw7De https://t.co/COjkvcva1o,How did you do in Connections today Youre given 16 words Your mission Identify the hidden relationships and organize them into four distinct groups of four
tweetImg20,"Singapore designed an entire neighborhood with heat in mind. A mix of tall, medium and short buildings works like a sail to capture cool sea breezes and direct them to the pedestrian level. https://t.co/1EXhS93CxP https://t.co/dLjyzkvcJM",Singapore designed an entire neighborhood with heat in mind A mix of tall medium and short buildings works like a sail to capture cool sea breezes and direct them to the pedestrian level
tweetImg21,"Singapore encourages the integration of greenery directly into buildings by offering financial incentives for rooftop gardens and vertical green facades. They work as natural blinds, shading the structure and reducing the need for air conditioning. https://t.co/1EXhS93CxP https://t.co/uCDTCIO4wa",Singapore encourages the integration of greenery directly into buildings by offering financial incentives for rooftop gardens and vertical green facades They work as natural blinds shading the structure and reducing the need for air conditioning
tweetImg22,"The design of this Singapore hospital funnels cool breezes from a neighboring pond, bringing cool air into the building. It integrates trees and plants to provide shade and reduce the heat absorbed by the building from the sun. https://t.co/1EXhS93CxP https://t.co/1DOvGsvGzK",The design of this Singapore hospital funnels cool breezes from a neighboring pond bringing cool air into the building It integrates trees and plants to provide shade and reduce the heat absorbed by the building from the sun
tweetImg23,"Nearly every aspect of how we build cities amplifies heat, from the buildings we live in to the cars we drive. But Singapore, which has warmed at twice the global average over the past six decades, may have lessons for other cities. https://t.co/1EXhS93CxP https://t.co/OcbVlcexqY",Nearly every aspect of how we build cities amplifies heat from the buildings we live in to the cars we drive But Singapore which has warmed at twice the global average over the past six decades may have lessons for other cities
tweetImg24,"""This soup is fantastic! My family devoured the whole pot.""

This taco soup is summer and fall in one spicy, satisfying bowl. https://t.co/3ix1JkPOb7 https://t.co/mER7Vq3qcs",This soup is fantastic My family devoured the whole pot This taco soup is summer and fall in one spicy satisfying bowl
tweetImg25,Watch Prime Minister Justin Trudeau of Canada say on Monday that “agents of the Indian government” had carried out the killing of a Sikh community leader in British Columbia in June. https://t.co/UueWBbVxYZ https://t.co/E8JUYXuVHZ,Watch Prime Minister Justin Trudeau of Canada say on Monday that agents of the Indian government had carried out the killing of a Sikh community leader in British Columbia in June
tweetImg26,"Don't think about all the Instagram-worthy pantries you've seen over the years and try to emulate them when organizing your own. You need something that works for you, not the internet.

Here's an easy step-by-step plan to organize your pantry. https://t.co/0xzXWm1WmD https://t.co/Sw0ERm46gF",Dont think about all the Instagramworthy pantries youve seen over the years and try to emulate them when organizing your own You need something that works for you not the internet Heres an easy stepbystep plan to organize your pantry
tweetImg27,"A woman found a rare N.C. Wyeth illustration while rummaging though frames at a Savers thrift store in New Hampshire.

Her bill for the long-lost work, which is expected to sell at auction on Tuesday for between $150,000 and $250,000? Four dollars. https://t.co/9zSFPiFWR8 https://t.co/28rdMwX3fw",A woman found a rare NC Wyeth illustration while rummaging though frames at a Savers thrift store in New Hampshire Her bill for the longlost work which is expected to sell at auction on Tuesday for between 150000 and 250000 Four dollars
tweetImg28,"A herd of 2,000 rhinoceroses urgently in need of a new owner has finally found one. The rhinos and the farm where they live in South Africa have been purchased by a conservation group that plans to release the animals into the wild over the next decade. https://t.co/mItSfsWyy3 https://t.co/8IKkwv2ND2",A herd of 2000 rhinoceroses urgently in need of a new owner has finally found one The rhinos and the farm where they live in South Africa have been purchased by a conservation group that plans to release the animals into the wild over the next decade
tweetImg29,Stop using so much laundry detergent. https://t.co/tvN60wYnA1 https://t.co/7crtZoQp03,Stop using so much laundry detergent
tweetImg30,"From @TheAthletic: Even a 15-foot wall in a Brooklyn art studio is no match for one of the NHL’s most thunderous checkers. Jacob Trouba has unveiled his previously unknown art skills. But the Rangers captain uses his body, not a brush. https://t.co/dZ3SiHGjTJ https://t.co/9mPwNrfKhj",From TheAthletic Even a 15foot wall in a Brooklyn art studio is no match for one of the NHLs most thunderous checkers Jacob Trouba has unveiled his previously unknown art skills But the Rangers captain uses his body not a brush
tweetImg31,"""This is my kind of recipe! Low effort, good reward, comes together quickly and doesn’t leave me with a mountain of dirty dishes. Amen."" 

These satiny coconut-ginger beans make for a delicious dinner with rice and greens. https://t.co/AukWRLWRJj https://t.co/OsVhbJt5uu",This is my kind of recipe Low effort good reward comes together quickly and doesnt leave me with a mountain of dirty dishes Amen These satiny coconutginger beans make for a delicious dinner with rice and greens
tweetImg32,"Boarding a red-eye without a travel pillow in your bag is like choosing to sleep on the floor when there’s a perfectly good futon nearby. 

After taking cross-country flights, our @Wirecutter experts found a travel pillow they can’t fly without. https://t.co/CP0avhbyPg https://t.co/cDjzENTb5R",Boarding a redeye without a travel pillow in your bag is like choosing to sleep on the floor when theres a perfectly good futon nearby After taking crosscountry flights our Wirecutter experts found a travel pillow they cant fly without
tweetImg33,"""I can vouch for this cookie — it's truly the perfect cookie, in my book: It's super easy to make and it achieves that perfect crisp-tender texture.""

These much-loved Peanut Butter-Miso Cookies were the result of a happy accident. https://t.co/t1YQhhSMi1 https://t.co/QAtdcnMWVz",I can vouch for this cookie its truly the perfect cookie in my book Its super easy to make and it achieves that perfect crisptender texture These muchloved Peanut ButterMiso Cookies were the result of a happy accident
tweetImg34,How quickly can you solve today's Mini crossword? https://t.co/NYAT6wfZQ8 https://t.co/g2PLmhWAFn,How quickly can you solve todays Mini crossword
tweetImg35,Our @Wirecutter testers have been hard at work testing our recommended cat litter. So please let us introduce you. And this is what they recommend: https://t.co/p4cr0Ojg0l https://t.co/Am1fgjK8Vf,Our Wirecutter testers have been hard at work testing our recommended cat litter So please let us introduce you And this is what they recommend
tweetImg36,How did you do in Connections today? You’re given 16 words. Your mission: Identify the hidden relationships and organize them into four distinct groups of four. https://t.co/DY6GLe1KJR https://t.co/3esKBA4kRa,How did you do in Connections today Youre given 16 words Your mission Identify the hidden relationships and organize them into four distinct groups of four
tweetImg37,"Iran released five Americans in a prisoner swap, as part of a deal in which the U.S. agreed to unfreeze $6 billion in Iranian oil revenue and dismiss federal charges against five Iranians accused of violating U.S. sanctions.
https://t.co/NgsDxWQgm8 https://t.co/ePKnRThm2B",Iran released five Americans in a prisoner swap as part of a deal in which the US agreed to unfreeze 6 billion in Iranian oil revenue and dismiss federal charges against five Iranians accused of violating US sanctions
tweetImg38,South Korea has the world’s largest diaspora of intercountry adoptees. Now some of them are returning to the country — which has the lowest birth rate globally — to hold the government accountable for what they call a corrupt and predatory adoption system. https://t.co/b0RMvyVOFg https://t.co/CfZ1d3rbIq,South Korea has the worlds largest diaspora of intercountry adoptees Now some of them are returning to the country which has the lowest birth rate globally to hold the government accountable for what they call a corrupt and predatory adoption system
tweetImg39,South Korea has the world’s largest diaspora of intercountry adoptees. Now some of them are returning to the country — which has the lowest birth rate globally — to hold the government accountable for what they call a corrupt and predatory adoption system. https://t.co/BJMb5mlxlP https://t.co/1RVCIkDLre,South Korea has the worlds largest diaspora of intercountry adoptees Now some of them are returning to the country which has the lowest birth rate globally to hold the government accountable for what they call a corrupt and predatory adoption system
tweetImg40,"Crab and oyster boat captains compete in a docking contest each year along the Maryland and Virginia shores that's like extreme parking with some rodeo at the end. ""This is like the true grit, what boats were originally intended for,"" one man said. https://t.co/cInZ9Nuab0 https://t.co/MuX62ZZcW1",Crab and oyster boat captains compete in a docking contest each year along the Maryland and Virginia shores thats like extreme parking with some rodeo at the end This is like the true grit what boats were originally intended for one man said
tweetImg41,"""This was Italian restaurant-level delicious.""

The classic Italian combination of sausage and peppers creates a satisfying and easy weeknight meal when combined with pasta. https://t.co/yUCrFdltkL https://t.co/LPsUMRgaU3",This was Italian restaurantlevel delicious The classic Italian combination of sausage and peppers creates a satisfying and easy weeknight meal when combined with pasta
tweetImg42,The secret ingredient your salads are missing: Marinating tomatoes is a quick and easy way to coax out their juices and make them the perfect complement to leafy greens. https://t.co/w8V0pz6USb https://t.co/HNFQnilnGf,The secret ingredient your salads are missing Marinating tomatoes is a quick and easy way to coax out their juices and make them the perfect complement to leafy greens
tweetImg43,"Thousands of people gathered in New York City on Sunday to demand that world leaders stop oil and gas drilling. The march was one of many global demonstrations, coming after the hottest summer on record and amid record profits for oil and gas companies. https://t.co/KA53VGYsId https://t.co/2F5wWhHTsb",Thousands of people gathered in New York City on Sunday to demand that world leaders stop oil and gas drilling The march was one of many global demonstrations coming after the hottest summer on record and amid record profits for oil and gas companies
tweetImg44,"Ahead of U.N. meetings this week, tens of thousands of people filled the streets of Midtown Manhattan on Sunday to demand that world leaders quickly pivot away from fossil fuels dangerously heating the Earth. https://t.co/8TK4oT6yp4 https://t.co/gEUSEwjnsz",Ahead of UN meetings this week tens of thousands of people filled the streets of Midtown Manhattan on Sunday to demand that world leaders quickly pivot away from fossil fuels dangerously heating the Earth
tweetImg45,"Crab and oyster boat captains compete in a docking contest each year along the Maryland and Virginia shores that's like extreme parking with some rodeo at the end. ""This is like the true grit, what boats were originally intended for,"" one man said. https://t.co/mYdMSXX9Yv https://t.co/Us5LV37r2Q",Crab and oyster boat captains compete in a docking contest each year along the Maryland and Virginia shores thats like extreme parking with some rodeo at the end This is like the true grit what boats were originally intended for one man said
tweetImg46,Connections is a daily game about finding common threads between words. Players must select four groups of four words without making more than four mistakes. https://t.co/Qo3KoeT413 https://t.co/Wd7q6fThth,Connections is a daily game about finding common threads between words Players must select four groups of four words without making more than four mistakes
tweetImg47,"""It's one of those things where I sit in amazement, with a full belly, asking myself 'how can this be so easy?'""

This super creamy, one-pot pasta uses grated corn to achieve its sweet, summery flavor. https://t.co/2KhzRr5hWM https://t.co/JAvYzH3m1m",Its one of those things where I sit in amazement with a full belly asking myself how can this be so easy This super creamy onepot pasta uses grated corn to achieve its sweet summery flavor
tweetImg48,South Korea has the world’s largest diaspora of intercountry adoptees. Now some of them are returning to the country — which has the lowest birth rate globally — to hold the government accountable for what they call a corrupt and predatory adoption system. https://t.co/MwBnMGdlMb https://t.co/FivluseVtk,South Korea has the worlds largest diaspora of intercountry adoptees Now some of them are returning to the country which has the lowest birth rate globally to hold the government accountable for what they call a corrupt and predatory adoption system
tweetImg49,Presenting the wildly popular Salted Chocolate Chunk Shortbread Cookies. This recipe takes the best parts of the iconic chocolate chip cookie and makes it better. https://t.co/ylc7LbPFG2 https://t.co/KioT5Aj85T,Presenting the wildly popular Salted Chocolate Chunk Shortbread Cookies This recipe takes the best parts of the iconic chocolate chip cookie and makes it better
tweetImg50,"Tomatoes and eggs are a popular pair the world over; this particular recipe is inspired by a version you’ll find in Lagos, Nigeria, using firm plantains. https://t.co/k9wAZfWhfI https://t.co/MjXqW8casP",Tomatoes and eggs are a popular pair the world over this particular recipe is inspired by a version youll find in Lagos Nigeria using firm plantains
tweetImg51,"""This was a great idea for those who enjoy Ruben sandwiches, but who are reducing their meat consumption.""

This vegetarian sandwich relies mostly on condiments and pantry staples and is within reach any day. https://t.co/StqEg8z1CZ https://t.co/2QH0sdibal",This was a great idea for those who enjoy Ruben sandwiches but who are reducing their meat consumption This vegetarian sandwich relies mostly on condiments and pantry staples and is within reach any day
tweetImg52,"""This was a wonderful dish! Easy, quick and delicious."" This one-skillet salmon dinner has the bright flavors of a salade Niçoise. https://t.co/TBlZW1gdmc https://t.co/MwXOZ0AuQ5",This was a wonderful dish Easy quick and delicious This oneskillet salmon dinner has the bright flavors of a salade Nioise
tweetImg53,"""This recipe is definitely a keeper."" This Citrusy Lentil and Sweet Potato Soup is hearty, cozy and surprisingly uplifting. https://t.co/A3PYqajy3d https://t.co/tQ9YxN8DSg",This recipe is definitely a keeper This Citrusy Lentil and Sweet Potato Soup is hearty cozy and surprisingly uplifting
tweetImg54,"We've pledged that every year, as summer gives way to fall, we will make sure that this recipe is easily available to one and all. 
A Times classic with over 11,000 ⭐⭐⭐⭐⭐ reviews. https://t.co/C0liKqKJxJ https://t.co/0QnIYNfm2m",Weve pledged that every year as summer gives way to fall we will make sure that this recipe is easily available to one and all A Times classic with over 11000 reviews
tweetImg55,Connections is a daily game about finding common threads between words. Players must select four groups of four words without making more than four mistakes. https://t.co/YTLC5xBg4S https://t.co/xWEqvxav9U,Connections is a daily game about finding common threads between words Players must select four groups of four words without making more than four mistakes
tweetImg56,"From @TheAthleticFC: Manchester United, global soccer’s “No. 1 club,” is beset by player controversies and internal tension between its past glories and future direction. https://t.co/1Z4vdGsFOY https://t.co/AhbVGkA38h",From TheAthleticFC Manchester United global soccers No 1 club is beset by player controversies and internal tension between its past glories and future direction
tweetImg57,"This spicy dish is quick and simple, ideal for breakfast or a hearty snack between meals, and can be customized with a variety of cheeses and toppings. https://t.co/GJCcHM1Khg https://t.co/NDtSSBFhVB",This spicy dish is quick and simple ideal for breakfast or a hearty snack between meals and can be customized with a variety of cheeses and toppings
tweetImg58,"Kerri Rawson sees her life in two parts: before and after she learned that her father was a serial killer. Now she is helping investigators solve cold cases that may involve her father. 

“This is my life. It’s not like I’ve been given a choice,” she said. https://t.co/AUn2AVo9HY https://t.co/ZQkvGjmxKN",Kerri Rawson sees her life in two parts before and after she learned that her father was a serial killer Now she is helping investigators solve cold cases that may involve her father This is my life Its not like Ive been given a choice she said
tweetImg59,Connections is a daily game about finding common threads between words. Players must select four groups of four words without making more than four mistakes. https://t.co/nUSxAjXT9N https://t.co/rK9zVF4Nph,Connections is a daily game about finding common threads between words Players must select four groups of four words without making more than four mistakes
