id,tweetContent,tweetContentProcessed
tweetImg598,"""This was eyes-rolled-back-in-your-head good. The fat from the chicken and the olive oil, the acid and spice from the jalapeños, sweetness from the corn, and generous salt, this was perfect. So, so, so good. My husband is still talking about it.""
https://t.co/Cl9UTiVyia https://t.co/jMb69aECNZ",This was eyesrolledbackinyourhead good The fat from the chicken and the olive oil the acid and spice from the jalapeos sweetness from the corn and generous salt this was perfect So so so good My husband is still talking about it
tweetImg599,"A private jet crashed onto a highway near an airport on the outskirts of Malaysia’s capital on Thursday, killing at least 10 people, the authorities said. https://t.co/8GenPfN6c3 https://t.co/McNQVu4rhP",A private jet crashed onto a highway near an airport on the outskirts of Malaysias capital on Thursday killing at least 10 people the authorities said
tweetImg600,"The total number of troop deaths and injuries in the Ukraine war is nearing 500,000, U.S. officials said, a staggering toll over 18 months. https://t.co/d5pCfOFWq7 https://t.co/0TiS2d7l2E",The total number of troop deaths and injuries in the Ukraine war is nearing 500000 US officials said a staggering toll over 18 months
tweetImg601,"Firefighters on the Spanish island of Tenerife are scrambling to contain a devastating fire, described as the most complicated in the Canary Islands in 40 years, after it blackened forests, prompted lockdowns and forced thousands of people to evacuate.
https://t.co/SP7zYxmxXY https://t.co/eyz5NLEAmB",Firefighters on the Spanish island of Tenerife are scrambling to contain a devastating fire described as the most complicated in the Canary Islands in 40 years after it blackened forests prompted lockdowns and forced thousands of people to evacuate
tweetImg602,"Close scrutiny of a recent image from the James Webb Space Telescope revealed some questionable punctuation in space.

Here’s what we know.
https://t.co/qcIpk6HxAA https://t.co/3rM6XRV8iY",Close scrutiny of a recent image from the James Webb Space Telescope revealed some questionable punctuation in space Heres what we know
tweetImg603,Connections is a daily game about finding common threads between words. Players must select four groups of four words without making more than four mistakes. https://t.co/ML1CW1Fkp0 https://t.co/IE4sAESVcn,Connections is a daily game about finding common threads between words Players must select four groups of four words without making more than four mistakes
tweetImg604,"This one-pan meal has over 3,000 🌟🌟🌟🌟🌟 reviews. 

It's a hearty fried egg-and-potato dish good for breakfast, lunch or dinner. https://t.co/RQwxzV5kMu https://t.co/j6CVQOrTd4",This onepan meal has over 3000 reviews Its a hearty fried eggandpotato dish good for breakfast lunch or dinner
tweetImg605,"""It's so good that it's on my top 10 vegetable side dishes of all time list.""

This is a simple layered casserole with three elements: roasted zucchini, a really good homemade tomato sauce and Parmesan. https://t.co/vWxFBSGMEv https://t.co/WfaDCQbt87",Its so good that its on my top 10 vegetable side dishes of all time list This is a simple layered casserole with three elements roasted zucchini a really good homemade tomato sauce and Parmesan
tweetImg606,"""I was leery about using plums in a savory dish, but this recipe is awesome!""

The bright, sweet-tart flavor of ripe plums comes through in this streamlined pork chop dinner. https://t.co/6Jpo6yChHK https://t.co/wljFRGTQxE",I was leery about using plums in a savory dish but this recipe is awesome The bright sweettart flavor of ripe plums comes through in this streamlined pork chop dinner
tweetImg607,"Roaches. Aphids. Rats. Summer in New York City brings seasonal delights as well as seasonal irritations. While there is a host of classic nuisances, a batch of new ones has arrived. In this quiz, it's up to you to choose what’s worse. https://t.co/6UqovJL0g8 https://t.co/TWBrFpGre5",Roaches Aphids Rats Summer in New York City brings seasonal delights as well as seasonal irritations While there is a host of classic nuisances a batch of new ones has arrived In this quiz its up to you to choose whats worse
tweetImg608,"Hundreds of wildfires have burned across Canada this summer, burning an unprecedented amount of land, but most of them have not threatened significant population centers.

The one near the Northwest Territories city of Yellowknife is different. https://t.co/w1XtjuMYhe https://t.co/BWyuceeTqo",Hundreds of wildfires have burned across Canada this summer burning an unprecedented amount of land but most of them have not threatened significant population centers The one near the Northwest Territories city of Yellowknife is different
tweetImg609,"The British singer Lily Allen has left music behind — at least for now — and turned her attention to acting. She is currently playing a lead role in a West End revival of “The Pillowman,” which is running at The Duke of York’s Theater. https://t.co/mhqFtgvX2N https://t.co/wtljITl99l",The British singer Lily Allen has left music behind at least for now and turned her attention to acting She is currently playing a lead role in a West End revival of The Pillowman which is running at The Duke of Yorks Theater
tweetImg610,"As a wildfire barreled toward a territorial capital in Canada on Thursday, an extraordinary citywide evacuation of thousands of people accelerated, with long lines of cars heading down the only highway south of the city. https://t.co/X55JVRzqVj https://t.co/867piWpxBx",As a wildfire barreled toward a territorial capital in Canada on Thursday an extraordinary citywide evacuation of thousands of people accelerated with long lines of cars heading down the only highway south of the city
tweetImg611,"The 30-year U.S. mortgage rate jumped to 7.09%, the highest since 2002, making it even harder for buyers to afford homes. https://t.co/YbDOGkwCo3 https://t.co/w4abghHOyx",The 30year US mortgage rate jumped to 709 the highest since 2002 making it even harder for buyers to afford homes
tweetImg612,Hurricane Hilary is expected to intensify into a major hurricane on Thursday before rapidly weakening on Saturday and making landfall somewhere along the west coast of Baja California or Southern California this weekend. https://t.co/rYhG1rrYHG https://t.co/ep3EHSC4FG,Hurricane Hilary is expected to intensify into a major hurricane on Thursday before rapidly weakening on Saturday and making landfall somewhere along the west coast of Baja California or Southern California this weekend
tweetImg613,"The National Mall will host “Pulling Together,” a temporary exhibition of prototype monuments to migration, desegregation, Native leaders and gay Americans. The installations represent who and what should be commemorated, our critic writes. https://t.co/PINafXLI3J https://t.co/gL6RoiedBC",The National Mall will host Pulling Together a temporary exhibition of prototype monuments to migration desegregation Native leaders and gay Americans The installations represent who and what should be commemorated our critic writes
tweetImg614,Our @Wirecutter testers have consistently ranked these earplugs as the ones they’d want to regularly wear — whether they’re watching Taylor Swift live or hiding from thunderstorms. https://t.co/9URePkv55i https://t.co/ctfgBKnZMr,Our Wirecutter testers have consistently ranked these earplugs as the ones theyd want to regularly wear whether theyre watching Taylor Swift live or hiding from thunderstorms
tweetImg615,"""I stumbled on a feature in my iPhone’s settings late at night, and was delighted the next morning by what awaited me."" Our @Wirecutter columnist recommends this simple phone feature, especially for parents. https://t.co/7V4Hf17m2E https://t.co/XHMdzyU6jh",I stumbled on a feature in my iPhones settings late at night and was delighted the next morning by what awaited me Our Wirecutter columnist recommends this simple phone feature especially for parents
tweetImg616,"From New York’s kosher classic to Alaska’s reindeer-driven rendition, hot dogs exhibit a striking diversity that reflects the regions in which they’ve evolved ever since the 1860s. Here’s a look at some of the varieties you may encounter across the U.S. https://t.co/sjGigtz8fS https://t.co/AYcLC1e7rJ",From New Yorks kosher classic to Alaskas reindeerdriven rendition hot dogs exhibit a striking diversity that reflects the regions in which theyve evolved ever since the 1860s Heres a look at some of the varieties you may encounter across the US
tweetImg617,From @TheAthletic: The death of an 18-year-old has brought new attention to the mental health challenges facing junior hockey players. https://t.co/2zKHFSOzqF https://t.co/eAtC6o1Gxu,From TheAthletic The death of an 18yearold has brought new attention to the mental health challenges facing junior hockey players
tweetImg618,"""I'm adding bourbon. Fight me.""

The recipe for this juicy pastry doesn't call for alcohol, but no judgment. https://t.co/CvtRvjbXPu https://t.co/5KepzNlPlm",Im adding bourbon Fight me The recipe for this juicy pastry doesnt call for alcohol but no judgment
tweetImg619,"This broccoli pasta is an ""absolute slam dunk."" It’s one of the best 15-minute pastas out there (as evidenced by its five-star rating and nearly 1,300 reader notes). https://t.co/Q4T0SvpSeh https://t.co/LdsiWbVRFq",This broccoli pasta is an absolute slam dunk Its one of the best 15minute pastas out there as evidenced by its fivestar rating and nearly 1300 reader notes
tweetImg620,Mayor Eric Adams announced plans to rezone manufacturing areas south of Times Square and allow more office buildings to be converted to housing in Midtown Manhattan. https://t.co/1M7VNhYBAQ https://t.co/xwWKDHXvvm,Mayor Eric Adams announced plans to rezone manufacturing areas south of Times Square and allow more office buildings to be converted to housing in Midtown Manhattan
tweetImg621,"Yes, it’s gimmicky, but the viral whipped cream sunscreen is exceptionally easy to apply and feels great on the skin, according to @Wirecutter testers. https://t.co/i9DM82e5Nd https://t.co/ZcAHnMKLhY",Yes its gimmicky but the viral whipped cream sunscreen is exceptionally easy to apply and feels great on the skin according to Wirecutter testers
tweetImg622,Connections is a daily game about finding common threads between words. Players must select four groups of four words without making more than four mistakes. https://t.co/S7CBfjSudd https://t.co/QIjXaZqE0j,Connections is a daily game about finding common threads between words Players must select four groups of four words without making more than four mistakes
tweetImg623,"Sure, some things are worth the splurge, but @Wirecutter has got the scoop on products that don't require you to break the bank. https://t.co/d3xnOCgTRt https://t.co/OKUQVvhOkY",Sure some things are worth the splurge but Wirecutter has got the scoop on products that dont require you to break the bank
tweetImg624,This is how you make the best scrambled eggs. https://t.co/95mUPSMQiC https://t.co/oRoFiuSrUj,This is how you make the best scrambled eggs
tweetImg625,"Canadian officials ordered an extraordinary citywide evacuation of Yellowknife, the capital of the Northwest Territories, as a wildfire moves toward it. The blaze is expected to reach the provincial capital by the weekend.
https://t.co/nhgl8M974A https://t.co/Vd1v8o9YbO",Canadian officials ordered an extraordinary citywide evacuation of Yellowknife the capital of the Northwest Territories as a wildfire moves toward it The blaze is expected to reach the provincial capital by the weekend
tweetImg626,"Scientists produced a recognizable version of Pink Floyd’s “Another Brick in the Wall (Part 1)” by training a computer to analyze the brain activity of someone listening to music and, based only on those neuronal patterns, recreate the song. https://t.co/A9aQHtUPzi https://t.co/Py7XoLGrlF",Scientists produced a recognizable version of Pink Floyds Another Brick in the Wall Part 1 by training a computer to analyze the brain activity of someone listening to music and based only on those neuronal patterns recreate the song
tweetImg627,"Vlatko Andonovski, the head coach of the U.S. women's national soccer team, resigned after the team underperformed in this year's World Cup. https://t.co/vAx0jL59O6 https://t.co/r8lhAihDvI",Vlatko Andonovski the head coach of the US womens national soccer team resigned after the team underperformed in this years World Cup
tweetImg628,"""This was fantastic!"" Readers love this mushroom and wild rice soup recipe. https://t.co/M2bAuqpnrC https://t.co/aO2XfdbZMG",This was fantastic Readers love this mushroom and wild rice soup recipe
tweetImg629,"From @TheAthletic: Meet college football’s most gifted athletes. Some can reach speeds of 20 miles per hour, jump 40 inches and slip into size 18 shoes. Those inside the sport describe why these players have them in awe. https://t.co/1HE5MKJDTK https://t.co/fomDq0kMRN",From TheAthletic Meet college footballs most gifted athletes Some can reach speeds of 20 miles per hour jump 40 inches and slip into size 18 shoes Those inside the sport describe why these players have them in awe
tweetImg630,Peach crisp is one of the joys of summer. https://t.co/beHf1lLBex https://t.co/TKtdrkcZuv,Peach crisp is one of the joys of summer
tweetImg631,"From @TheAthleticFC: For eight minutes, Sam Kerr let Australia rejoice. Her legacy will last much longer. “The only thing that’s keeping me smiling right now is the way that we’ve inspired the nation. Everyone’s got behind us,” she said afterward. https://t.co/WfnzOLJaew https://t.co/apqIsxOReS",From TheAthleticFC For eight minutes Sam Kerr let Australia rejoice Her legacy will last much longer The only thing thats keeping me smiling right now is the way that weve inspired the nation Everyones got behind us she said afterward
tweetImg632,"“Recipes like this make me feel like I can participate in the fun complexity of cocktail crafting, even though alcohol isn't my friend.” 

Here's how to make a nonalcoholic dirty lemon tonic. https://t.co/GELkXhdrb3 https://t.co/TjW55ldVcW",Recipes like this make me feel like I can participate in the fun complexity of cocktail crafting even though alcohol isnt my friend Heres how to make a nonalcoholic dirty lemon tonic
tweetImg633,From @TheAthletic: Tourette syndrome nearly took baseball away from him. Then came the triumphant comeback. https://t.co/Nz7hTSy0rZ https://t.co/SrAIkr3MS1,From TheAthletic Tourette syndrome nearly took baseball away from him Then came the triumphant comeback
tweetImg634,"This is our most popular chocolate chip cookie recipe and may become your new favorite.
https://t.co/DT3DNHZPJ5 https://t.co/aFMNgjC5H4",This is our most popular chocolate chip cookie recipe and may become your new favorite
tweetImg635,Many cultures have put a spin on the empanada. This recipe descends from the Argentine way of making these little meat pies. https://t.co/Q8v0rsBxos https://t.co/YlpBZP4hGn,Many cultures have put a spin on the empanada This recipe descends from the Argentine way of making these little meat pies
tweetImg636,"""This is a phenomenal work-from-home lunch, not remotely meant to be photogenic, just cheap, filling, and delicious.""

This recipe transforms the sushi-restaurant specialty of spicy tuna crispy rice into a simple any-night meal. https://t.co/bGAUod0V5Y https://t.co/yyvsbMEGm2",This is a phenomenal workfromhome lunch not remotely meant to be photogenic just cheap filling and delicious This recipe transforms the sushirestaurant specialty of spicy tuna crispy rice into a simple anynight meal
tweetImg637,"""I make this all the time. Very simple, clean, fresh tastes."" In just 20 minutes, you can easily make this cucumber salad. https://t.co/daHv8bjPvY https://t.co/EfhiaPEHLf",I make this all the time Very simple clean fresh tastes In just 20 minutes you can easily make this cucumber salad
tweetImg638,"The DealBook Summit returns on Nov. 29 with @andrewrsorkin hosting a day of candid interviews with some of the most consequential leaders in business, politics and culture.

Apply to attend: https://t.co/eRFmHN5lXu https://t.co/BmdivXKUr8",The DealBook Summit returns on Nov 29 with andrewrsorkin hosting a day of candid interviews with some of the most consequential leaders in business politics and culture Apply to attend
tweetImg639,"England 🏴󠁧󠁢󠁥󠁮󠁧󠁿 beat Australia 🇦🇺 in the Women's World Cup semifinals, winning 3-1, on Wednesday. They'll now play against Spain in the finals on Sunday. https://t.co/g7x8zdO92d https://t.co/OXhJjVIeEg",England beat Australia in the Womens World Cup semifinals winning 31 on Wednesday Theyll now play against Spain in the finals on Sunday
tweetImg640,"Vitamin prices are confounding. If you follow this @Wirecutter formula, you can find vitamins that are as good as those costing 10 to 20 times more.
https://t.co/trcbecCMX5 https://t.co/CVXPLpfj0c",Vitamin prices are confounding If you follow this Wirecutter formula you can find vitamins that are as good as those costing 10 to 20 times more
tweetImg641,Connections is a daily game about finding common threads between words. Players must select four groups of four words without making more than four mistakes. https://t.co/CAQcNtKvl7 https://t.co/uqsG4qeO2A,Connections is a daily game about finding common threads between words Players must select four groups of four words without making more than four mistakes
tweetImg642,From @TheAthleticFC: England will play in a World Cup final for the first time since 1966 after the Lionesses beat co-hosts Australia 3-1 in Sydney. This is how they won the superb semi-final. https://t.co/9i4B93aZ0E https://t.co/KmBXefP2N1,From TheAthleticFC England will play in a World Cup final for the first time since 1966 after the Lionesses beat cohosts Australia 31 in Sydney This is how they won the superb semifinal
tweetImg643,"Breaking News: England 🏴󠁧󠁢󠁥󠁮󠁧󠁿 beat Australia 🇦🇺, 3-1, at the Women's World Cup to secure a place in the final against Spain on Sunday. https://t.co/Q8JrmQs9a9 https://t.co/N08W51bUAm",Breaking News England beat Australia 31 at the Womens World Cup to secure a place in the final against Spain on Sunday
tweetImg644,"""Huge hit whenever I make it. Leftovers (which are rare) are great on pasta or avocado toast the next day.""

This baked feta dip, with spicy tomatoes and honey, is tangy, creamy and easy to make. https://t.co/MpEqi0Xta1 https://t.co/94ik9ZxUZx",Huge hit whenever I make it Leftovers which are rare are great on pasta or avocado toast the next day This baked feta dip with spicy tomatoes and honey is tangy creamy and easy to make
tweetImg645,"The fourth criminal indictment of Donald Trump, like a federal indictment earlier this month, concerns his efforts to overturn the 2020 election. Read our annotated version of the indictment. https://t.co/WgEwX3v0V2 https://t.co/0OLz1R2bDV",The fourth criminal indictment of Donald Trump like a federal indictment earlier this month concerns his efforts to overturn the 2020 election Read our annotated version of the indictment
tweetImg646,We tested 24 detergents on the grimiest dishes and found one that came the closest to cleaning nearly everything. https://t.co/qEkuvGU877 https://t.co/Iw4HrNSYTR,We tested 24 detergents on the grimiest dishes and found one that came the closest to cleaning nearly everything
tweetImg647,"When a Wisconsin news outlet claimed a businessman used an anti-gay slur, he sued for defamation. A judge dismissed the case, but the legal bills could still close the site. https://t.co/T1b955lHQV https://t.co/A8rz3aNkzR",When a Wisconsin news outlet claimed a businessman used an antigay slur he sued for defamation A judge dismissed the case but the legal bills could still close the site
tweetImg648,"The fourth criminal indictment of Donald Trump, like a federal indictment earlier this month, concerns his efforts to overturn the 2020 election. Read our annotated version of the indictment. https://t.co/3vEJNhOXib https://t.co/mGsq40nVbO",The fourth criminal indictment of Donald Trump like a federal indictment earlier this month concerns his efforts to overturn the 2020 election Read our annotated version of the indictment
tweetImg649,"Xuxa was once Brazil’s biggest TV star. Now many are wondering whether she was the right idol for such a diverse country. “I didn’t see it as wrong back then. Today, we know it’s wrong,” Xuxa said of the beauty standard she portrayed to Brazil’s youth. https://t.co/T5xoZiXsZ5 https://t.co/r9FVk0yQch",Xuxa was once Brazils biggest TV star Now many are wondering whether she was the right idol for such a diverse country I didnt see it as wrong back then Today we know its wrong Xuxa said of the beauty standard she portrayed to Brazils youth
tweetImg650,"The fourth criminal indictment of Donald Trump, like a federal indictment earlier this month, concerns his efforts to overturn the 2020 election. Read our annotated version of the indictment. https://t.co/c7Kw70IfWc https://t.co/jTuHxieYFL",The fourth criminal indictment of Donald Trump like a federal indictment earlier this month concerns his efforts to overturn the 2020 election Read our annotated version of the indictment
tweetImg651,"This spicy one-pot pasta dish is common on menus in Bari, Italy, but can easily be prepared at home in just 20 minutes. https://t.co/96AIwXBUCG https://t.co/EGxeVP2NRD",This spicy onepot pasta dish is common on menus in Bari Italy but can easily be prepared at home in just 20 minutes
tweetImg652,"Typhoon Lan pummeled western Japan on Tuesday. Power was knocked out in thousands of homes, hundreds of flights were canceled and summer traditions, such as the nationwide baseball tournament, were called off. At least 20 people were injured. https://t.co/eC5Deh1nDV https://t.co/U1ZeNYowqR",Typhoon Lan pummeled western Japan on Tuesday Power was knocked out in thousands of homes hundreds of flights were canceled and summer traditions such as the nationwide baseball tournament were called off At least 20 people were injured
tweetImg653,"Xuxa era a Barbie do Brasil: loira, magra e branca. Ela foi a ídola de milhões de brasileiros que cresceram a assistindo na TV. Mas agora, o país — e a própria Xuxa — questiona a marca que ela deixou. https://t.co/QYNl9Pg4Hs https://t.co/UqnjXQ2rWg",Xuxa era a Barbie do Brasil loira magra e branca Ela foi a dola de milhes de brasileiros que cresceram a assistindo na TV Mas agora o pas e a prpria Xuxa questiona a marca que ela deixou
tweetImg654,"""I have made this twice and it is easy and simply fantastic!""

This vegetarian dish is inspired by prasorizo, the classic Greek rice-and-leek dish. https://t.co/ERQjillbfi https://t.co/6VNkPovXKe",I have made this twice and it is easy and simply fantastic This vegetarian dish is inspired by prasorizo the classic Greek riceandleek dish
tweetImg655,"A grand jury in Georgia on Monday unveiled the fourth criminal indictment of Donald Trump. Like a federal indictment earlier this month, this one also concerns his efforts to overturn the 2020 election. Read our annotated version of the indictment here. https://t.co/oWNLriTPhC https://t.co/g7T2hjTUHZ",A grand jury in Georgia on Monday unveiled the fourth criminal indictment of Donald Trump Like a federal indictment earlier this month this one also concerns his efforts to overturn the 2020 election Read our annotated version of the indictment here
tweetImg656,"Interviews and videos show how a deadly blaze spread through Lahaina, Hawaii, in just a few hours.

As the wildfire overran the historic coastal town, many residents fled for their lives — but there was nowhere to go. https://t.co/kX6BfH0wXP https://t.co/4zx8B1EJxc",Interviews and videos show how a deadly blaze spread through Lahaina Hawaii in just a few hours As the wildfire overran the historic coastal town many residents fled for their lives but there was nowhere to go
tweetImg657,"""Fantastic! Easy to make and wonderful on a hot night.""

This zucchini soup with lemon and basil is entirely no-cook — just blend, garnish and serve. 
 https://t.co/4nvVViBHxv https://t.co/MjtgGHhtz4",Fantastic Easy to make and wonderful on a hot night This zucchini soup with lemon and basil is entirely nocook just blend garnish and serve
tweetImg658,From @TheAthletic: Meet college football’s most gifted athletes. This year's Freaks list includes players with physical abilities that wow even those who observe talented athletes every day. https://t.co/hSv6auFZJa https://t.co/wbwrqXqfX8,From TheAthletic Meet college footballs most gifted athletes This years Freaks list includes players with physical abilities that wow even those who observe talented athletes every day
tweetImg659,"You can only use one pen for the rest of your life; which one is it? 

@Wirecutter staffers have done rigorous testing to pick the favorite. https://t.co/PGRkw9kH1e https://t.co/0ui2K38plc",You can only use one pen for the rest of your life which one is it Wirecutter staffers have done rigorous testing to pick the favorite
tweetImg660,"Spain 🇪🇸 will compete in the Women's World Cup final for the first time, after beating Sweden 🇸🇪, 2-1. https://t.co/IYeFJRmr2U https://t.co/mJKrntDMKX",Spain will compete in the Womens World Cup final for the first time after beating Sweden 21
tweetImg661,"Spain reached its first Women's World Cup final after a dramatic late goal, beating Sweden, 2-1. The team will now face Australia or England in Sydney on Sunday. https://t.co/ToKeXyFg2R https://t.co/nJWgFnqkry",Spain reached its first Womens World Cup final after a dramatic late goal beating Sweden 21 The team will now face Australia or England in Sydney on Sunday
