id,tweetContent,tweetContentProcessed
tweetImg247,"The Biden administration will prohibit drilling in 13 million acres of pristine wilderness in the National Petroleum Reserve in Alaska and cancel all drilling leases in the Arctic National Wildlife Refuge, it announced on Wednesday. https://t.co/fDbX4HGaRh https://t.co/znFSGnyFDK",The Biden administration will prohibit drilling in 13 million acres of pristine wilderness in the National Petroleum Reserve in Alaska and cancel all drilling leases in the Arctic National Wildlife Refuge it announced on Wednesday
tweetImg248,"""Delicious, unusual and a big hit with guests."" This pudding is like Mexican street corn and cornbread had a baby. https://t.co/zittaRuyXf https://t.co/EN77LjvqSi",Delicious unusual and a big hit with guests This pudding is like Mexican street corn and cornbread had a baby
tweetImg249,"Breaking News: Mexico has decriminalized abortion nationwide, in a decision that shows how Latin American countries are expanding reproductive rights. https://t.co/Y1oWoyHqWL https://t.co/rReT37Alk9",Breaking News Mexico has decriminalized abortion nationwide in a decision that shows how Latin American countries are expanding reproductive rights
tweetImg250,"With the pace of a court having a significant effect on play, the U.S. Open resurfaces and tests each of its 17 courts every year to guarantee consistent pace. See more U.S. Open Coverage. https://t.co/DVUUbxeLbT https://t.co/HXdrS0wfxA",With the pace of a court having a significant effect on play the US Open resurfaces and tests each of its 17 courts every year to guarantee consistent pace See more US Open Coverage
tweetImg251,"Tournament organizers attempt to control the pace of the surface wherever they can. At the U.S. Open, tournament officials have added sand to the white line paint in order to minimize balls sliding off the line. https://t.co/DVUUbxeLbT https://t.co/ZIpFOhzpUB",Tournament organizers attempt to control the pace of the surface wherever they can At the US Open tournament officials have added sand to the white line paint in order to minimize balls sliding off the line
tweetImg252,"To test the U.S. Open’s court speed, officials use a device that measures friction and restitution. Friction is how much resistance the court surface provides as the ball makes contact. Restitution measures the energy lost to the court after a bounce. https://t.co/DVUUbxeLbT https://t.co/NI9IFbJSpN",To test the US Opens court speed officials use a device that measures friction and restitution Friction is how much resistance the court surface provides as the ball makes contact Restitution measures the energy lost to the court after a bounce
tweetImg253,"Tournament organizers can dial in a specific pace for the courts. At the U.S. Open, the surface is categorized as “medium-fast,” meaning that fans are likely to see fewer long rallies and quicker matches. https://t.co/DVUUbxeLbT https://t.co/Jk4wD7NVr8",Tournament organizers can dial in a specific pace for the courts At the US Open the surface is categorized as mediumfast meaning that fans are likely to see fewer long rallies and quicker matches
tweetImg254,"Now take a look at this high-resolution scan of the surface in Arthur Ashe. Notice the structure of the granules of sand layered into the acrylic paint. The size, shape and density of the sand make up the court surface and dictate the speed of the ball. https://t.co/DVUUbxeLbT https://t.co/oqUKqN46US",Now take a look at this highresolution scan of the surface in Arthur Ashe Notice the structure of the granules of sand layered into the acrylic paint The size shape and density of the sand make up the court surface and dictate the speed of the ball
tweetImg255,"From the seats in Arthur Ashe Stadium, the tennis court below appears smooth and uniform. Even the players who sprint and slide across the blue hardcourt can barely see or sense a characteristic that significantly sets the tone for their matches. https://t.co/DVUUbxeLbT https://t.co/8uOG21k2eW",From the seats in Arthur Ashe Stadium the tennis court below appears smooth and uniform Even the players who sprint and slide across the blue hardcourt can barely see or sense a characteristic that significantly sets the tone for their matches
tweetImg256,"WinRed, the Republican party’s donation-processing digital platform, helps their candidates create and sell their wares at lightning speed. But there's one problem: all the stores look the same. https://t.co/XnR3vEiG22 https://t.co/GjmkNY2pPS",WinRed the Republican partys donationprocessing digital platform helps their candidates create and sell their wares at lightning speed But theres one problem all the stores look the same
tweetImg257,"Edith Grossman, whose acclaimed translations of “Love in the Time of Cholera” by Gabriel García Márquez and “Don Quixote” by Miguel de Cervantes raised the profile of the often-overlooked role of the translator, died on Monday. She was 87. https://t.co/KqGr1oTRLu https://t.co/dcOq7irEAA",Edith Grossman whose acclaimed translations of Love in the Time of Cholera by Gabriel Garca Mrquez and Don Quixote by Miguel de Cervantes raised the profile of the oftenoverlooked role of the translator died on Monday She was 87
tweetImg258,"Across South Asia, there is a revered, intoxicating sweetness to most mangoes. Adding yogurt and milk to chopped bits balances that sweetness and makes this Punjabi mango lassi the perfect chilled drink for hot summer months. https://t.co/lklcTxTJKV https://t.co/onDTnkQNy3",Across South Asia there is a revered intoxicating sweetness to most mangoes Adding yogurt and milk to chopped bits balances that sweetness and makes this Punjabi mango lassi the perfect chilled drink for hot summer months
tweetImg259,"At least 27 people were killed and 3,000 were displaced from a cyclone in southern Brazil this week, prompting the federal government to dispatch helicopters for rescues. Volunteers held hands to create a human chain and pull in boats carrying people. https://t.co/AcQr3bhrvH https://t.co/2DzhWhGwuw",At least 27 people were killed and 3000 were displaced from a cyclone in southern Brazil this week prompting the federal government to dispatch helicopters for rescues Volunteers held hands to create a human chain and pull in boats carrying people
tweetImg260,"At least 10 people were killed by major floods unleashed by torrential rain in Bulgaria, Greece and Turkey. In Bulgaria, flooding washed cars and caravans into the sea, while in Greece the record rains came on the back of major wildfires. https://t.co/JjNdcMSFC3 https://t.co/gP0VJO6m1u",At least 10 people were killed by major floods unleashed by torrential rain in Bulgaria Greece and Turkey In Bulgaria flooding washed cars and caravans into the sea while in Greece the record rains came on the back of major wildfires
tweetImg261,"At least 16 people were killed Wednesday in a Russian strike on Kostyantynivka, a city in eastern Ukraine that is close to the front lines. The number of casualties and the injured may rise, according to President Volodymyr Zelensky of Ukraine. https://t.co/OyzjYoDvVl https://t.co/5ISb5Sqthv",At least 16 people were killed Wednesday in a Russian strike on Kostyantynivka a city in eastern Ukraine that is close to the front lines The number of casualties and the injured may rise according to President Volodymyr Zelensky of Ukraine
tweetImg262,"There are few things better for breakfast than fried potatoes swimming in a velvety pool of eggy custard, Cheddar cheese, seared bits of sage sausage and scallions. This recipe is inspired by hot dish, the Midwestern classic. https://t.co/lHaG8OLdtC https://t.co/hEWvgIZEtC",There are few things better for breakfast than fried potatoes swimming in a velvety pool of eggy custard Cheddar cheese seared bits of sage sausage and scallions This recipe is inspired by hot dish the Midwestern classic
tweetImg263,"""A phenomenal pairing with salmon.""

A fragrant mixed-herb pesto made from fresh chives and parsley coats creamy baby potatoes and summer green beans or asparagus in this vibrant salad. https://t.co/GEahmy7KFy https://t.co/TmtdNjF7sT",A phenomenal pairing with salmon A fragrant mixedherb pesto made from fresh chives and parsley coats creamy baby potatoes and summer green beans or asparagus in this vibrant salad
tweetImg264,"From @TheAthletic: Erin Matson is Division I's youngest head coach in any sport. The ""Michael Jordan of field hockey"" is coaching her teammates at 23, one year after she led UNC to the national title. https://t.co/vbTrzpL9fP https://t.co/Y9zSkdhRRS",From TheAthletic Erin Matson is Division Is youngest head coach in any sport The Michael Jordan of field hockey is coaching her teammates at 23 one year after she led UNC to the national title
tweetImg265,"Leif Haugen scans a 300,000-acre patch of Montana for fires from a one-room mountaintop cabin. He is part of a band of watchers who stand on solitary guard. But as land managers look to technology to monitor wildfires, the lookouts’ days might be numbered.
https://t.co/NxmIN0L1js https://t.co/Z2njI6uRlU",Leif Haugen scans a 300000acre patch of Montana for fires from a oneroom mountaintop cabin He is part of a band of watchers who stand on solitary guard But as land managers look to technology to monitor wildfires the lookouts days might be numbered
tweetImg266,Connections is a daily game about finding common threads between words. Players must select four groups of four words without making more than four mistakes. https://t.co/ZYldlTmLQL https://t.co/T3P3FclTF8,Connections is a daily game about finding common threads between words Players must select four groups of four words without making more than four mistakes
tweetImg267,"From @TheAthletic: Days away from the NFL season opener, it's time to rank every team from 1 to 32, with a look at all best- and worst-case scenarios. https://t.co/FYrr6PsT9s https://t.co/dr6kkn12b7",From TheAthletic Days away from the NFL season opener its time to rank every team from 1 to 32 with a look at all best and worstcase scenarios
tweetImg268,"It's called Midnight Pasta, but you can eat it anytime, day or night. https://t.co/ubWaToHskl https://t.co/ZQUDQUA6Wx",Its called Midnight Pasta but you can eat it anytime day or night
tweetImg269,Connections is a daily game about finding common threads between words. Players must select four groups of four words without making more than four mistakes. https://t.co/eA2rQMeKu4 https://t.co/HZLsvrVt9D,Connections is a daily game about finding common threads between words Players must select four groups of four words without making more than four mistakes
tweetImg270,"This white lasagna, layered with asparagus, spinach, peas and lemony ricotta, is like a baked pasta primavera in its richest form. https://t.co/U21KUNJr6C https://t.co/7TeLdXQgWD",This white lasagna layered with asparagus spinach peas and lemony ricotta is like a baked pasta primavera in its richest form
tweetImg271,"Breaking News: Enrique Tarrio, the former leader of the Proud Boys, was given 22 years in prison for his role in organizing a gang of his pro-Trump followers to attack the Capitol on Jan. 6, 2021, and stop the peaceful transfer of presidential power. https://t.co/pPo7bRvhjG https://t.co/hebpVYED4k",Breaking News Enrique Tarrio the former leader of the Proud Boys was given 22 years in prison for his role in organizing a gang of his proTrump followers to attack the Capitol on Jan 6 2021 and stop the peaceful transfer of presidential power
tweetImg272,"The pool at the Quality Inn in Absecon, New Jersey, just kept turning green. After the general manager suspected a drone was involved, the police arrested a man who they say was likely “pranking people” by using one to turn multiple pools yellow and green. https://t.co/vaw7IZyRIW https://t.co/HErECOtuta",The pool at the Quality Inn in Absecon New Jersey just kept turning green After the general manager suspected a drone was involved the police arrested a man who they say was likely pranking people by using one to turn multiple pools yellow and green
tweetImg273,"Breaking News: The NYPD agreed to stop its practice of boxing in protesters and then arresting them, known as kettling, under a settlement with the state and the New York Civil Liberties Union. https://t.co/lxu2MiKFg4 https://t.co/ASa0A8cI58",Breaking News The NYPD agreed to stop its practice of boxing in protesters and then arresting them known as kettling under a settlement with the state and the New York Civil Liberties Union
tweetImg274,"Lawsuits, protests and fierce disputes over who controls water in the parched American West have held up a crucial pipeline that Thornton, Colorado, has been trying to build for nearly 40 years. https://t.co/6q6wv54PwL https://t.co/IjJKstAzoa",Lawsuits protests and fierce disputes over who controls water in the parched American West have held up a crucial pipeline that Thornton Colorado has been trying to build for nearly 40 years
tweetImg275,"Runaway Medicare spending was the story of the federal budget for decades. Now, flat Medicare spending might be a bigger one — and the reason for the slowdown is a bit of a mystery. https://t.co/OH3uzl7Ves https://t.co/B8REYYmJry",Runaway Medicare spending was the story of the federal budget for decades Now flat Medicare spending might be a bigger one and the reason for the slowdown is a bit of a mystery
tweetImg276,"Tens of thousands of people who had been stranded at the Burning Man festival after days of heavy rain began a mucky, uncertain trek away from the remote festival grounds in Nevada on Monday. https://t.co/Mzuodt7PKS https://t.co/xL4SFkU01B",Tens of thousands of people who had been stranded at the Burning Man festival after days of heavy rain began a mucky uncertain trek away from the remote festival grounds in Nevada on Monday
tweetImg277,"""This has to be one of the best-tasting pasta dishes I have ever made!""

Pasta alla vodka is already delicious. Adding ricotta takes it to another level. https://t.co/0Pmjxv4Dcv https://t.co/fhdam0efWJ",This has to be one of the besttasting pasta dishes I have ever made Pasta alla vodka is already delicious Adding ricotta takes it to another level
tweetImg278,"Breaking News: Jorge Vilda, the coach of the Spanish national soccer team that won the Women’s World Cup last month, was ousted on Tuesday by the country’s soccer federation. His boss, Luis Rubiales, is embroiled in scandal over a nonconsensual kiss. https://t.co/bk2v66CGKN https://t.co/8nCAhE6Rtq",Breaking News Jorge Vilda the coach of the Spanish national soccer team that won the Womens World Cup last month was ousted on Tuesday by the countrys soccer federation His boss Luis Rubiales is embroiled in scandal over a nonconsensual kiss
tweetImg279,"Not to be confused with a Latin American tamale, a tamale pie is a beloved retro casserole in the U.S. Serve this one-pot meal on its own or with a creamy dollop of sour cream or yogurt. https://t.co/YGaNzqO0Em https://t.co/eIcqRrzNhc",Not to be confused with a Latin American tamale a tamale pie is a beloved retro casserole in the US Serve this onepot meal on its own or with a creamy dollop of sour cream or yogurt
tweetImg280,Connections is a daily game about finding common threads between words. Players must select four groups of four words without making more than four mistakes. https://t.co/6LTCQ7EPEK https://t.co/rrNj8tUjWR,Connections is a daily game about finding common threads between words Players must select four groups of four words without making more than four mistakes
tweetImg281,"Tens of thousands of people who had spent days stranded at the Burning Man festival began to stream away from the sprawling site in remote northwest Nevada on Monday.
https://t.co/fLoJKFiqdc https://t.co/wIZWV16Ca3",Tens of thousands of people who had spent days stranded at the Burning Man festival began to stream away from the sprawling site in remote northwest Nevada on Monday
tweetImg282,“This is the best chicken I’ve ever had.” A dash of gin and a smattering of fried sage make these sautéed chicken breasts more than the usual weeknight dinner. https://t.co/A6gucAH2Jv https://t.co/Yq1k2IqYI0,This is the best chicken Ive ever had A dash of gin and a smattering of fried sage make these sauted chicken breasts more than the usual weeknight dinner
tweetImg283,"Elaine LaLanne revolutionized modern exercise alongside her husband, Jack. At 97, she is still inspiring fitness professionals and is a model for aging well.
https://t.co/L9XZU9fiPq https://t.co/6lQh5NpRnW",Elaine LaLanne revolutionized modern exercise alongside her husband Jack At 97 she is still inspiring fitness professionals and is a model for aging well
tweetImg284,"French macarons can be tricky for even the most seasoned bakers, but these tips and tricks will put them well within reach.
https://t.co/gg6jFQBXZ6 https://t.co/xJtLMYEJns",French macarons can be tricky for even the most seasoned bakers but these tips and tricks will put them well within reach
tweetImg285,"Steve Harwell, the former lead singer of the rock band Smash Mouth, which was best known for its ubiquitous 1999 hit “All Star,” died on Monday. He was 56.
https://t.co/fXXsMdyaaf https://t.co/PiClvRHPsx",Steve Harwell the former lead singer of the rock band Smash Mouth which was best known for its ubiquitous 1999 hit All Star died on Monday He was 56
tweetImg286,"""This is a phenomenal work-from-home lunch, not remotely meant to be photogenic, just cheap, filling, and delicious.""
https://t.co/IJBtFQqCC8 https://t.co/N0r1WbJ0S3",This is a phenomenal workfromhome lunch not remotely meant to be photogenic just cheap filling and delicious
tweetImg287,"This chocolate cake recipe has been called the “world’s best chocolate cake.” You could also call it the “world’s easiest cake” or “most versatile cake.”
https://t.co/FGpdCXWB83 https://t.co/437Hj5nMfM",This chocolate cake recipe has been called the worlds best chocolate cake You could also call it the worlds easiest cake or most versatile cake
tweetImg288,"Clearing skies over northwest Nevada may permit the mass exodus of tens of thousands of people from the Burning Man festival, where they have been stranded for days after heavy rains, organizers said.
https://t.co/MCkMFJg0XO https://t.co/7K7jcxdTK5",Clearing skies over northwest Nevada may permit the mass exodus of tens of thousands of people from the Burning Man festival where they have been stranded for days after heavy rains organizers said
tweetImg289,Connections is a daily game about finding common threads between words. Players must select four groups of four words without making more than four mistakes. https://t.co/wBHQAgNszV https://t.co/gDs72XYcIq,Connections is a daily game about finding common threads between words Players must select four groups of four words without making more than four mistakes
tweetImg290,"""Ignore the reviewers who didn’t actually make this recipe and touted their own homemade concoctions. This recipe is fantastic.""
The most popular comment agrees: This is how you make the best scrambled eggs. https://t.co/3iSySD3DZI https://t.co/QdEXzkqxyC",Ignore the reviewers who didnt actually make this recipe and touted their own homemade concoctions This recipe is fantastic The most popular comment agrees This is how you make the best scrambled eggs
tweetImg291,Don’t let mosquitoes ruin a good time. Here’s what doesn’t work — and what does. https://t.co/IYJCvdGrlk https://t.co/IneERHRVUa,Dont let mosquitoes ruin a good time Heres what doesnt work and what does
tweetImg292,"In many Italian American households, Sunday means there’s red sauce simmering all day on the stove. 

This recipe + a green salad + crusty bread + red wine = a perfect night. https://t.co/Hss0YEa1QB https://t.co/CDlLcTpt7g",In many Italian American households Sunday means theres red sauce simmering all day on the stove This recipe a green salad crusty bread red wine a perfect night
tweetImg293,"Thousands of people at the Burning Man festival in a Nevada desert remained stranded there Sunday after torrential rains turned roads into muck, cutting off access. Officials urged campers to conserve food and water. True to form, some took it in stride. https://t.co/zIptbs8TrU https://t.co/CkKkKiYd4J",Thousands of people at the Burning Man festival in a Nevada desert remained stranded there Sunday after torrential rains turned roads into muck cutting off access Officials urged campers to conserve food and water True to form some took it in stride
tweetImg294,"Thousands of people were stuck at the Burning Man festival in Nevada this weekend because of rain and mud. It was not clear when, or how, attendees would get out. Police are investigating the death of one person at the festival. 

Here's what we know. https://t.co/em9XC00uaL https://t.co/cLG7m2o7qg",Thousands of people were stuck at the Burning Man festival in Nevada this weekend because of rain and mud It was not clear when or how attendees would get out Police are investigating the death of one person at the festival Heres what we know
tweetImg295,Fabian Nelson won a Democratic primary runoff on Tuesday in Mississippi’s 66th state House district. He spoke to The New York Times about the significance of being the first openly LGBTQ legislator in the state — but why he never focused on it on the trail.https://t.co/JbYMcojZFT https://t.co/bDplNjCqvW,Fabian Nelson won a Democratic primary runoff on Tuesday in Mississippis 66th state House district He spoke to The New York Times about the significance of being the first openly LGBTQ legislator in the state but why he never focused on it on the trail
tweetImg296,Connections is a daily game about finding common threads between words. Players must select four groups of four words without making more than four mistakes. https://t.co/XuQWMJC7Nz https://t.co/WUsv4hRgKU,Connections is a daily game about finding common threads between words Players must select four groups of four words without making more than four mistakes
tweetImg297,"""The dish came tougher super fast and was very satisfying, tasty weeknight meal.""

We could use all sorts of fancy words to explain this dish, but the best description is this: pizza in rice form. https://t.co/Rh5uMTKtz9 https://t.co/DZndRWDLEf",The dish came tougher super fast and was very satisfying tasty weeknight meal We could use all sorts of fancy words to explain this dish but the best description is this pizza in rice form
tweetImg298,"Jimmy Buffett, the bard of Margaritaville, who died on Friday at 76, took a form of laid-back dressing instantly recognizable to anyone who ever hung around a boatyard and made it mainstream both at home and abroad. https://t.co/dQj4Lw8neF https://t.co/AMWkygRbRu",Jimmy Buffett the bard of Margaritaville who died on Friday at 76 took a form of laidback dressing instantly recognizable to anyone who ever hung around a boatyard and made it mainstream both at home and abroad
tweetImg299,"""It was really delicious, and healthy too.""

This roasted broccoli with a vinegar-mustard glaze has a cult following. https://t.co/azW1UUpQsC https://t.co/lNveRXpJQF",It was really delicious and healthy too This roasted broccoli with a vinegarmustard glaze has a cult following
tweetImg300,Readers reacted to the news of Jimmy Buffett’s death and shared their own memories of the singer whose brand of escapism on hits like “Margaritaville” made him a folk hero. Read more here: https://t.co/IKyQNb4ls2 https://t.co/ZoP9AduS2R,Readers reacted to the news of Jimmy Buffetts death and shared their own memories of the singer whose brand of escapism on hits like Margaritaville made him a folk hero Read more here
tweetImg301,"""I ate this whole thing by myself. All of it.""

This unfussy cake is so gooey it’s best to serve the whole thing with a spoon. https://t.co/3TSa9eKhIL https://t.co/pO3A763acL",I ate this whole thing by myself All of it This unfussy cake is so gooey its best to serve the whole thing with a spoon
tweetImg302,Readers reacted to the news of Jimmy Buffett’s death and shared their own memories of the singer whose brand of escapism on hits like “Margaritaville” made him a folk hero. Read more here: https://t.co/8M1DJwOV4i https://t.co/vtfNO1601F,Readers reacted to the news of Jimmy Buffetts death and shared their own memories of the singer whose brand of escapism on hits like Margaritaville made him a folk hero Read more here
tweetImg303,"If you have a crowd for breakfast, overnight French toast is a winning idea. 
https://t.co/kSgtQmw5jR https://t.co/RPWjFMnucH",If you have a crowd for breakfast overnight French toast is a winning idea
tweetImg304,"Jimmy Buffett, the singer, songwriter, author, sailor and entrepreneur whose roguish brand of island escapism on hits like “Margaritaville” made him a folk hero, especially among his devoted following of so-called Parrot Heads, died on Friday. He was 76. https://t.co/kmswmHOBjy https://t.co/wcY2nCRyrI",Jimmy Buffett the singer songwriter author sailor and entrepreneur whose roguish brand of island escapism on hits like Margaritaville made him a folk hero especially among his devoted following of socalled Parrot Heads died on Friday He was 76
tweetImg305,"In Oceanside, the palm trees sway and the temperature is almost always perfect. There is just one problem: The sand is disappearing. Leaders are now rushing to reimagine the shoreline and make it a new kind of California beach town — before it's too late. https://t.co/WShJvgQ40J https://t.co/HAPxyvdr3Q",In Oceanside the palm trees sway and the temperature is almost always perfect There is just one problem The sand is disappearing Leaders are now rushing to reimagine the shoreline and make it a new kind of California beach town before its too late
