id,tweetContent,tweetContentProcessed
tweetImg421,From @TheAthletic: A new type of football helmet is making waves in concussion prevention. https://t.co/VqD6dYpX9s https://t.co/PnscYbbDO9,From TheAthletic A new type of football helmet is making waves in concussion prevention
tweetImg422,A vigil was held at Saint Paul AME Church of Jacksonville for the three victims killed on Saturday by a gunman targeting Black people at a Dollar General store. Authorities are investigating the shooting as a hate crime. https://t.co/nOXeadeNOh https://t.co/Q3sj7ukStX,A vigil was held at Saint Paul AME Church of Jacksonville for the three victims killed on Saturday by a gunman targeting Black people at a Dollar General store Authorities are investigating the shooting as a hate crime
tweetImg423,It was impossible for our @Wirecutter editor to find anything in the black hole that was her car trunk. Now it’s an orderly library of emergency-preparedness supplies and other essentials. https://t.co/RPI7dgmuch https://t.co/wjPy8JhMxe,It was impossible for our Wirecutter editor to find anything in the black hole that was her car trunk Now its an orderly library of emergencypreparedness supplies and other essentials
tweetImg424,"On “The Price Is Right,” contestants summoned to the podiums were often screaming and hyperventilating — just fully freaking out. Bob Barker, the show’s longtime host, who died Saturday, was the still point in this delirious world, Alexis Soloski writes. https://t.co/zZdaWhkNP7 https://t.co/YRJmYp85Tn",On The Price Is Right contestants summoned to the podiums were often screaming and hyperventilating just fully freaking out Bob Barker the shows longtime host who died Saturday was the still point in this delirious world Alexis Soloski writes
tweetImg425,"It's the 68th anniversary of the lynching murder of 14-year-old Emmett Till. In this virtual reality documentary, we explore how the Mississippi towns where his murder took place are trying to memorialize him. https://t.co/fEGQySZa5v https://t.co/UttHaoSvDb",Its the 68th anniversary of the lynching murder of 14yearold Emmett Till In this virtual reality documentary we explore how the Mississippi towns where his murder took place are trying to memorialize him
tweetImg426,"Gov. Ron DeSantis was booed and heckled at a vigil for three people killed in an attack where a gunman targeted Black people in a store in Jacksonville, Florida. https://t.co/clVa3ZYBmf https://t.co/WZzD635Zgy",Gov Ron DeSantis was booed and heckled at a vigil for three people killed in an attack where a gunman targeted Black people in a store in Jacksonville Florida
tweetImg427,"A UN panel said Monday that all countries have a legal obligation to protect children from environmental degradation, including by “regulating business enterprises” and allowing their underage citizens to seek legal recourse. https://t.co/8AS2A4ryye https://t.co/5BDmBG62YJ",A UN panel said Monday that all countries have a legal obligation to protect children from environmental degradation including by regulating business enterprises and allowing their underage citizens to seek legal recourse
tweetImg428,"Michael Locksley says he continues to differentiate between his son’s mental decline and his CTE. “I’m a layman,” he said. “and my layman’s mind-set is that they weren’t really connected, and maybe they aren’t. Maybe they were. I don’t know.”  https://t.co/ylSYlWjrpq https://t.co/XA1ILfDkuU",Michael Locksley says he continues to differentiate between his sons mental decline and his CTE Im a layman he said and my laymans mindset is that they werent really connected and maybe they arent Maybe they were I dont know
tweetImg429,"The news of CTE swamped Kia Locksley with regret.
“My God, I could have done something differently,” she said, tearing up.

After a pause, she added: “A little guilt.” https://t.co/ylSYlWjrpq https://t.co/epLuw9hvr7",The news of CTE swamped Kia Locksley with regret My God I could have done something differently she said tearing up After a pause she added A little guilt
tweetImg430,"“I didn’t ask for this disease. Why do I have this? Just shoot me now. Just kill me.” These are words Meiko Locksley’s mother, Kia, remembered him saying during an incident at their home. She said she had to release “all the dreams that I had for him.” https://t.co/ylSYlWjrpq https://t.co/W3lmR6WxGg",I didnt ask for this disease Why do I have this Just shoot me now Just kill me These are words Meiko Locksleys mother Kia remembered him saying during an incident at their home She said she had to release all the dreams that I had for him
tweetImg431,"Locksley said that he did not know the role that CTE played in his son’s decline, and he is right. Researchers cannot make direct links, either. A direct link to CTE would be an inconvenient truth for a man whose livelihood depends on football. https://t.co/ylSYlWjZeY https://t.co/Rd9aJ0sDnn",Locksley said that he did not know the role that CTE played in his sons decline and he is right Researchers cannot make direct links either A direct link to CTE would be an inconvenient truth for a man whose livelihood depends on football
tweetImg432,"Michael Locksley had his son’s brain sent to be studied by researchers at Boston University, who diagnosed the CTE. His brain is one of 152 they have studied of contact-sport athletes under the age of 30. Of those, 63 had CTE. https://t.co/ylSYlWjrpq https://t.co/puJZ0eofVS",Michael Locksley had his sons brain sent to be studied by researchers at Boston University who diagnosed the CTE His brain is one of 152 they have studied of contactsport athletes under the age of 30 Of those 63 had CTE
tweetImg433,"His son Meiko was a standout high-school football player who bounced between college programs as his mind and life slipped into darkness in his early 20s. He was shot and killed at 25, in Maryland, not far from his home. https://t.co/ylSYlWjrpq https://t.co/CsjeyupyuV",His son Meiko was a standout highschool football player who bounced between college programs as his mind and life slipped into darkness in his early 20s He was shot and killed at 25 in Maryland not far from his home
tweetImg434,"The coach, Michael Locksley, said that his son’s mental decline didn’t make sense to him and that he wondered, “Maybe it had something to do with these concussions” that Meiko sustained playing youth, high school and college football. https://t.co/ylSYlWjrpq https://t.co/nqDJeU2hM3",The coach Michael Locksley said that his sons mental decline didnt make sense to him and that he wondered Maybe it had something to do with these concussions that Meiko sustained playing youth high school and college football
tweetImg435,"The head football coach at Maryland lost his son to murder in 2017 after a period of mental decline. The coach has now revealed to The New York Times that his son, a football player, had CTE, a brain disease often associated with playing the sport. https://t.co/ylSYlWjrpq https://t.co/4A7O4Dfo1X",The head football coach at Maryland lost his son to murder in 2017 after a period of mental decline The coach has now revealed to The New York Times that his son a football player had CTE a brain disease often associated with playing the sport
tweetImg436,"Filled with vegetables and milky cheese, this One-Pan Zucchini-Pesto Orzo is especially satisfying and very easy to make.  https://t.co/qDuOUJ6PcO https://t.co/OTCzzF3jPN",Filled with vegetables and milky cheese this OnePan ZucchiniPesto Orzo is especially satisfying and very easy to make
tweetImg437,You might assume you’re getting something much better for a higher price. But vitamin prices are often deceiving. The inexpensive options can be just as good — if you pick the right ones. https://t.co/qb1moqbezP https://t.co/ukz9HIzyky,You might assume youre getting something much better for a higher price But vitamin prices are often deceiving The inexpensive options can be just as good if you pick the right ones
tweetImg438,"Our @Wirecutter-approved dog poop bags are strong, thick enough to be reassuring and not let you feel what you’re picking up too closely — but they’re also thin enough to be easy to open and separate from the roll. https://t.co/zSOnWyQ41c https://t.co/gdpEcxnTpl",Our Wirecutterapproved dog poop bags are strong thick enough to be reassuring and not let you feel what youre picking up too closely but theyre also thin enough to be easy to open and separate from the roll
tweetImg439,Connections is a daily game about finding common threads between words. Players must select four groups of four words without making more than four mistakes. https://t.co/l66se1AGld https://t.co/BtS12rJFXC,Connections is a daily game about finding common threads between words Players must select four groups of four words without making more than four mistakes
tweetImg440,"""I had to give it 5 stars because this could make a cauliflower eater out of me."" This roasted cauliflower with crispy Parmesan is one of our most popular recipes of the year, so far. https://t.co/qMwqFinP5K https://t.co/Aoz4RdZVHF",I had to give it 5 stars because this could make a cauliflower eater out of me This roasted cauliflower with crispy Parmesan is one of our most popular recipes of the year so far
tweetImg441,"Brown butter, crunchy almonds and tangy lemon make a rich but balanced sauce for this pantry-friendly pasta.
https://t.co/xB20tijBoo https://t.co/muhYbXWVc7",Brown butter crunchy almonds and tangy lemon make a rich but balanced sauce for this pantryfriendly pasta
tweetImg442,"Sixty years after the March on Washington and Martin Luther King’s “I Have a Dream” speech galvanized supporters of the Civil Rights Movement with a call to action, thousands gathered on Saturday to remind the U.S. of its unfinished work on equality. https://t.co/MYxJzypjPr https://t.co/8eooteFWnX",Sixty years after the March on Washington and Martin Luther Kings I Have a Dream speech galvanized supporters of the Civil Rights Movement with a call to action thousands gathered on Saturday to remind the US of its unfinished work on equality
tweetImg443,"Russian investigators on Sunday said genetic tests showed that the Wagner chief, Yevgeny Prigozhin, was among the victims of a plane crash last week, just two months after he launched a brief mutiny against Moscow’s military leadership. https://t.co/xsDdgwSBuK https://t.co/nKBv1QQmS3",Russian investigators on Sunday said genetic tests showed that the Wagner chief Yevgeny Prigozhin was among the victims of a plane crash last week just two months after he launched a brief mutiny against Moscows military leadership
tweetImg444,"A road trip is an adventure. It doesn’t matter how far you go. But all adventures require a little planning (and one or two backup plans, in case things go sideways). https://t.co/xPaWykCr0g https://t.co/m0209fPN2Y",A road trip is an adventure It doesnt matter how far you go But all adventures require a little planning and one or two backup plans in case things go sideways
tweetImg445,"This dumpling tomato salad with chile crisp vinaigrette is one of our most popular recipes of 2023, so far. It's a genius dish primed for picnics. https://t.co/DUQcmwRb0V https://t.co/RgNFz7neCl",This dumpling tomato salad with chile crisp vinaigrette is one of our most popular recipes of 2023 so far Its a genius dish primed for picnics
tweetImg446,"Russian investigators on Sunday said genetic tests showed that the Wagner chief, Yevgeny Prigozhin, was among the victims of a plane crash last week, just two months after he launched a brief mutiny against Moscow’s military leadership. https://t.co/CbCUQYQQtl https://t.co/kSle7vjLXp",Russian investigators on Sunday said genetic tests showed that the Wagner chief Yevgeny Prigozhin was among the victims of a plane crash last week just two months after he launched a brief mutiny against Moscows military leadership
tweetImg447,"""I added the booze and it was a HUGE success.""

This crowd-pleasing recipe for caramelized banana pudding doesn't require alcohol, but why not. https://t.co/LRU3pr7nzI https://t.co/9H4UhuBkci",I added the booze and it was a HUGE success This crowdpleasing recipe for caramelized banana pudding doesnt require alcohol but why not
tweetImg448,Connections is a daily game about finding common threads between words. Players must select four groups of four words without making more than four mistakes. https://t.co/mfKZWX5MjN https://t.co/cFvw0nM2vr,Connections is a daily game about finding common threads between words Players must select four groups of four words without making more than four mistakes
tweetImg449,"""This looks EXACTLY like something I’d invent when I’m hungover. Yum!!!!""

When French toast meets kimchi grilled cheese, we arrive at a surprising and joyous union. https://t.co/8qtDw5scUt https://t.co/E9bBFUMCPH",This looks EXACTLY like something Id invent when Im hungover Yum When French toast meets kimchi grilled cheese we arrive at a surprising and joyous union
tweetImg450,"Served warm from the oven, with a dab of softly whipped cream, this lemon pudding melts in your mouth. It is one of our most popular recipes of 2023, so far.  https://t.co/vzyu7hAltf https://t.co/T3uVavq08h",Served warm from the oven with a dab of softly whipped cream this lemon pudding melts in your mouth It is one of our most popular recipes of 2023 so far
tweetImg451,"""Spicy, sweet, delicious, and easy.""
""Many thanks for including instructions for a single serving. The onesies of the world salute you.""

Readers love these garlicky, buttery gochujang noodles. https://t.co/ITCLhm7r0C https://t.co/PHBFK0cyWA",Spicy sweet delicious and easy Many thanks for including instructions for a single serving The onesies of the world salute you Readers love these garlicky buttery gochujang noodles
tweetImg452,"These tiny forests — native plants crowded onto small plots — have been delivering environmental benefits around the world. They can help lower temperatures in places where pavement, buildings and concrete surfaces absorb and retain heat from the sun. https://t.co/8LLGRToiiA https://t.co/a1PZ6g1jOy",These tiny forests native plants crowded onto small plots have been delivering environmental benefits around the world They can help lower temperatures in places where pavement buildings and concrete surfaces absorb and retain heat from the sun
tweetImg453,"This traditional Southern caramel cake is perfect for when you want layer cake, and you'd like it fast. https://t.co/Nk2oIfUfQ2 https://t.co/HAcZ3nMu0m",This traditional Southern caramel cake is perfect for when you want layer cake and youd like it fast
tweetImg454,Breaking News: Bob Barker is dead at 99. The longtime host of “The Price Is Right” was a daytime television fixture for half a century. He was also well known for his advocacy of animal rights. https://t.co/rhjd2BD1KW https://t.co/sPBAFpY5uq,Breaking News Bob Barker is dead at 99 The longtime host of The Price Is Right was a daytime television fixture for half a century He was also well known for his advocacy of animal rights
tweetImg455,"From @TheAthletic: Thirty years later, an enduring charm remains with “The Sandlot.” One of the most iconic lines in baseball movie history was actually a mistake, and it’s part of what makes the film so endearing. https://t.co/JXQKcbxn2p https://t.co/HWlSUFGqD3",From TheAthletic Thirty years later an enduring charm remains with The Sandlot One of the most iconic lines in baseball movie history was actually a mistake and its part of what makes the film so endearing
tweetImg456,This simple olive oil ice cream tastes velvety and luxurious and doesn’t require an ice cream maker. https://t.co/JZIX9KqjLy https://t.co/Ic44I2g2aI,This simple olive oil ice cream tastes velvety and luxurious and doesnt require an ice cream maker
tweetImg457,"It is impossible to agree on the best instant noodles. There are thousands of varieties. 

But we asked chefs, ramen reviewers, cookbook authors, and noodle makers to tell us their favorites, and then conducted our own taste test. https://t.co/e7UPgeKQt0 https://t.co/mNAfjrzhSV",It is impossible to agree on the best instant noodles There are thousands of varieties But we asked chefs ramen reviewers cookbook authors and noodle makers to tell us their favorites and then conducted our own taste test
tweetImg458,From @TheAthletic: We ranked all 30 NFL stadiums from best to worst. https://t.co/BiLuW2Dfw1 https://t.co/FkuuBUuAfL,From TheAthletic We ranked all 30 NFL stadiums from best to worst
tweetImg459,"""So good and super easy, perfect for the work week.""

These juicy chicken thighs have a tangy, spicy-sweet flavor profile. https://t.co/ZGJaYTnFLr https://t.co/WuzGyHoudg",So good and super easy perfect for the work week These juicy chicken thighs have a tangy spicysweet flavor profile
tweetImg460,"After more than 75 hours of researching knife sets and testing 18, @Wirecutter is confident that nothing beats this one.  https://t.co/w65jHfmRb8 https://t.co/GG8ODzWqI2",After more than 75 hours of researching knife sets and testing 18 Wirecutter is confident that nothing beats this one
tweetImg461,Connections is a daily game about finding common threads between words. Players must select four groups of four words without making more than four mistakes. https://t.co/esbisg5u9z https://t.co/r0xHsTzFhT,Connections is a daily game about finding common threads between words Players must select four groups of four words without making more than four mistakes
tweetImg462,"Firefighters in Greece are battling blazes near Athens and in Evros, where about 180,000 acres have burned, according to an E.U. official who called it a record. Authorities investigating the fires arrested dozens of people on suspicion of arson. https://t.co/fWy4El3rw3 https://t.co/tLa6gw2wq7",Firefighters in Greece are battling blazes near Athens and in Evros where about 180000 acres have burned according to an EU official who called it a record Authorities investigating the fires arrested dozens of people on suspicion of arson
tweetImg463,Connections is a daily game about finding common threads between words. Players must select four groups of four words without making more than four mistakes. https://t.co/5NrFVqGMtk https://t.co/OgV1qbsbrg,Connections is a daily game about finding common threads between words Players must select four groups of four words without making more than four mistakes
tweetImg464,There’s nothing like a perfect panna cotta. This recipe is simple and ideal to make in advance. https://t.co/Abtp3idOaM https://t.co/B8kNurTHtf,Theres nothing like a perfect panna cotta This recipe is simple and ideal to make in advance
tweetImg465,"It was a beach day in Maine, but 225 people went to a library in Brunswick for a children’s book event. Sarah McCloskey, the real-life inspiration for “Blueberries for Sal” (1948) was reading handful of classics by her father, Robert McCloskey. https://t.co/7oUyyWY6ct https://t.co/Tzvt9dhBxE",It was a beach day in Maine but 225 people went to a library in Brunswick for a childrens book event Sarah McCloskey the reallife inspiration for Blueberries for Sal 1948 was reading handful of classics by her father Robert McCloskey
tweetImg466,"The Fed chair Jerome Powell pledged on Friday that his central bank would stick by its push to stamp out rapid inflation “until the job is done,” and said that officials were ready to raise interest rates further if needed. https://t.co/YwxRXA4XCp https://t.co/H4H44UbnBT",The Fed chair Jerome Powell pledged on Friday that his central bank would stick by its push to stamp out rapid inflation until the job is done and said that officials were ready to raise interest rates further if needed
tweetImg467,"Firefighters in Greece are battling blazes near Athens and in Evros, where about 180,000 acres have burned, according to an E.U. official who called it a record. Authorities investigating the fires arrested dozens of people on suspicion of arson. https://t.co/W1ea6i2hAr https://t.co/yLXL6btQBR",Firefighters in Greece are battling blazes near Athens and in Evros where about 180000 acres have burned according to an EU official who called it a record Authorities investigating the fires arrested dozens of people on suspicion of arson
tweetImg468,"A Pimm’s cup is a summertime favorite English cocktail, famously sold in the stands at Wimbledon. This frozen version is easy to make at home and is perfect for sweltering nights. https://t.co/BjkdAOeZvh https://t.co/CT6dRmuyay",A Pimms cup is a summertime favorite English cocktail famously sold in the stands at Wimbledon This frozen version is easy to make at home and is perfect for sweltering nights
tweetImg469,"There’s no need to order takeout from your neighborhood restaurant when this beloved, easy-to-assemble Italian-American classic gets dinner on the table in no time. https://t.co/60FW2XvKlD https://t.co/zQpY8c1xRw",Theres no need to order takeout from your neighborhood restaurant when this beloved easytoassemble ItalianAmerican classic gets dinner on the table in no time
tweetImg470,"""Guests kept serving themselves again and again.""

This pasta salad is loaded with two pounds of zucchini, roasted until golden and caramelized, then tossed in a tangy garlic-tahini dressing. https://t.co/zpP1PkhYgu https://t.co/KSpYL1QxFd",Guests kept serving themselves again and again This pasta salad is loaded with two pounds of zucchini roasted until golden and caramelized then tossed in a tangy garlictahini dressing
tweetImg471,"From @TheAthletic: Inside the headset can be the most stressful or entertaining place in any football stadium. From inside jokes to colorful language and full-on meltdowns, we asked a dozen-plus coaches for their very best stories. https://t.co/JNpDxvNcyO https://t.co/T6Q3s8N2ID",From TheAthletic Inside the headset can be the most stressful or entertaining place in any football stadium From inside jokes to colorful language and fullon meltdowns we asked a dozenplus coaches for their very best stories
tweetImg472,Connections is a daily game about finding common threads between words. Players must select four groups of four words without making more than four mistakes. https://t.co/mluxmBAsh3 https://t.co/IXUqAeuC6a,Connections is a daily game about finding common threads between words Players must select four groups of four words without making more than four mistakes
tweetImg473,Eight candidates took the stage for the first Republican presidential debate. But two who weren't there — Donald Trump and President Biden — were the most frequent targets of attacks from those looking to win the GOP nomination. See more: https://t.co/1cdKkZanzq https://t.co/haPkwru78V,Eight candidates took the stage for the first Republican presidential debate But two who werent there Donald Trump and President Biden were the most frequent targets of attacks from those looking to win the GOP nomination See more
tweetImg474,"How much does Frank the meerkat weigh? The London Zoo found out this week as it conducted its annual weigh-in of all 14,000 animals at the zoo, “from the tallest giraffe to the tiniest tadpole.”
https://t.co/lYyNfkLxzS https://t.co/om2N7ftdBs",How much does Frank the meerkat weigh The London Zoo found out this week as it conducted its annual weighin of all 14000 animals at the zoo from the tallest giraffe to the tiniest tadpole
tweetImg475,"Creamy, frosty and tart, this popular Brazilian drink is a fantastic refreshment for a hot day. 
https://t.co/Pm4PITHwqk https://t.co/jGA7zvM50i",Creamy frosty and tart this popular Brazilian drink is a fantastic refreshment for a hot day
tweetImg476,"Start casually thinking about your holiday gifts now. Holiday gifting is a marathon, not a sprint, and both the quality and the value of your gifts will increase if you start earlier. https://t.co/qld7CZR0WJ https://t.co/TEkU9dGP9u",Start casually thinking about your holiday gifts now Holiday gifting is a marathon not a sprint and both the quality and the value of your gifts will increase if you start earlier
tweetImg477,Connections is a daily game about finding common threads between words. Players must select four groups of four words without making more than four mistakes. https://t.co/BsEdTIoA7p https://t.co/M7RUWkH82y,Connections is a daily game about finding common threads between words Players must select four groups of four words without making more than four mistakes
tweetImg478,"Breaking News: Fulton County officials released Donald Trump’s mug shot, the first taken in the four criminal cases he’s faced this year. https://t.co/AM57iLHUgo https://t.co/su6eI8JRF2",Breaking News Fulton County officials released Donald Trumps mug shot the first taken in the four criminal cases hes faced this year
tweetImg479,"Breaking News: Donald Trump was booked on state felony charges at the Fulton County Jail in Atlanta — the fourth time he’s surrendered to authorities this year. 

Follow our live updates. 
https://t.co/WsJq8y3A3U https://t.co/hRekNvRX9s",Breaking News Donald Trump was booked on state felony charges at the Fulton County Jail in Atlanta the fourth time hes surrendered to authorities this year Follow our live updates
tweetImg480,"This was the scene as Donald Trump arrived in Georgia ahead of his booking on racketeering charges. He's now arrived at an Atlanta jail and has surrendered to the authorities.

Follow our live updates. https://t.co/s7wCcWmBxF https://t.co/ieCnNRJ4T4",This was the scene as Donald Trump arrived in Georgia ahead of his booking on racketeering charges Hes now arrived at an Atlanta jail and has surrendered to the authorities Follow our live updates
